{
  "$schema": "../../schemas/alibabacloud-resourcecenter-runtime-evidence.v0.1.schema.json",
  "schema_version": "0.1.0",
  "evaluation_id": "TITMAS-AAG-ALIBABACLOUD-RESOURCECENTER-20260802",
  "observed_at": "2026-08-02T08:54:01.930397Z",
  "request_id": "aar-alibaba-cloud-preflight-20260802",
  "provenance": {
    "base_commit": "6f1c83bf87e6ee96a0eda281e1fa91b8f80a32e1",
    "dirty": true,
    "git_status_sha256": "90625542bfed658407997609df56257419a6962a1608e606e7aebe3fc4b4b4bc",
    "workspace_manifest_sha256": "d564bc598d926b6c99a5d7d2fce95e6089f01b3460050614613a83339ebf5d3f",
    "runner_sha256": "c6890bb7865bbf0fab7baac42cc79806a0eabf92e51bcf41f8279cfb88347aaa",
    "adapter_sha256": "b93d95d26216642885f0bbe03ff8ecf5ebb37227dbf10f9bc72556e3a0e73d54",
    "service_sha256": "2f2aa7204dfcbc9439c58dc75e921aad519df643f6f8f5f12c970b9bc4fdbfed",
    "evidence_adapter_sha256": "b053abb012afb339c947afe186940b8588ffd992710436db6b37684601e91603",
    "public_evidence_validator_sha256": "7a726d09b3b29ff8d47717303d3e620c37a4245a903806840df8963252b9cb87",
    "result_schema_sha256": "0861b7e60c4faac22f5df079c1c1ca1a153d3b8c2549841efa5c3964d561c3df",
    "policy_observation_schema_sha256": "457e1b9216b4a00f4c13b9ee585f531572df5e8d0f39280e08f53bec64fc3609",
    "policy_observation_producer_sha256": "a68ec44f560ea50dd0366bcc7c0ab0de378480ca2dfd744a4e5434e218d3a498",
    "public_evidence_schema_sha256": "b53b84a1b21033e576286f28c32db4e06ff72ce7ef9c3a6e056b810c42fcf246",
    "source_lock_sha256": "26346f8c1b44b49fdf036f71dc49edd25f56de88d2f79eb676d46637c0bae461",
    "policy_observation_sha256": "0f96840f957667994e562b1792758ac205b54b596be3566668f598f457cb536f",
    "cli_version": "3.4.11",
    "aliyun_cli_sha256": "7a418ea428dcbfeaab2af8760938aeda8d2f16bd77b586cbe4c75b07034df8fb",
    "resourcecenter_plugin_version": "0.7.0",
    "resourcecenter_plugin_sha256": "5a18d50b91c10a8db1c603aa28b86b69bb1a6614921ef06198a186862261a145"
  },
  "action_request": {
    "schema_version": "0.1.0",
    "request_id": "aar-alibaba-cloud-preflight-20260802",
    "created_at": "2026-08-02T08:54:01.930397Z",
    "requested_by": {
      "agent_id": "release-steward",
      "team_id": "titmas-action-gate"
    },
    "action": "github.release.create",
    "target": {
      "provider": "github",
      "repository": "joy7758/titmas-agent-action-gate",
      "resource_ref": "release/competition-demo-not-created"
    },
    "parameters": {
      "tag": "competition-demo-not-created",
      "draft": true
    },
    "parameters_sha256": "9c38fecc71c8e5cb3dfed538e6536a1f5772c0db9a609e4f27911f72f8f17508",
    "evidence_requirements": [
      "SOURCE_PIN",
      "TEST_RESULT",
      "TAG_STATE",
      "RELEASE_MANIFEST",
      "CLOUD_CONTEXT"
    ],
    "uncertainty": [
      "Cloud context is read-only evidence and grants no deployment or release authority.",
      "This evaluation does not create a GitHub release or any cloud workload resource."
    ],
    "idempotency_key": "alibaba-cloud-preflight-20260802"
  },
  "runtime": {
    "surface": "AUTHENTICATED_FASTMCP_STREAMABLE_HTTP",
    "principal": "cloud-context-inspector",
    "tool": "inspect_alibabacloud_resources",
    "allowed_call_recorded": true,
    "negative_principal": "request-analyst",
    "negative_result": "MCP_TOOL_NOT_ALLOWED",
    "native_agentteams_llm_worker_turn": false
  },
  "cloud_context": {
    "schema_version": "0.1.0",
    "preflight_id": "cloud-preflight-0bdb3596a8e1fc3bc01ce8cae1e61e10",
    "request_id": "aar-alibaba-cloud-preflight-20260802",
    "status": "NOT_ASSESSED_NO_VISIBLE_RESOURCE",
    "observed_at": "2026-08-02T08:54:01.976877Z",
    "skill": {
      "name": "alibabacloud-resourcecenter-search",
      "repository": "https://github.com/aliyun/alibabacloud-aiops-skills",
      "revision": "92bd723f7cc217b252feab574c1883fa0aa46b3c",
      "source_lock_sha256": "26346f8c1b44b49fdf036f71dc49edd25f56de88d2f79eb676d46637c0bae461",
      "external_path_reference": "external://titmas/skills/alibabacloud-resourcecenter-search",
      "discovered": true,
      "loaded": true,
      "load_scope": "EXTERNAL_SKILL_SOURCE_VERIFICATION",
      "native_agentteams_loaded": false,
      "runtime_load_result": "SOURCE_VERIFIED_NOT_NATIVE_LOADED",
      "invocation_scope": "SKILL_BOUND_ADAPTER",
      "runtime_invoked": true
    },
    "query": {
      "operation": "resourcecenter.search-resources",
      "max_results": 1,
      "filter_keys": [],
      "include_deleted_resources": false,
      "confirmation_ref": "confirmation:e3f602a4fd564910313383ab1f553d8317d06e4b440c1b49b600178a013d288c"
    },
    "credential": {
      "credential_ref": "sha256:e57f614cb4f8c0a70c79a3da9ded4b50155972476f07d08a1d61b36d6d7b34d1",
      "permission_identity_ref": "sha256:d5dfdaf092de944ea6a34dbc7edc16903b6aac180f69c0fb48d8b1a903c4dda1",
      "permission_role_ref": "sha256:c172f1e2c0106e474ae5e0327854abf05c051f7e9a59fea9b1d97ae0b4b18a3f",
      "permission_policy_ref": "sha256:0f96840f957667994e562b1792758ac205b54b596be3566668f598f457cb536f",
      "read_only_policy_verified": "PASS"
    },
    "invocation": {
      "invoked": true,
      "result_class": "EMPTY_RESULT",
      "cli_version": "3.4.11",
      "command": "aliyun resourcecenter search-resources --max-results 1 --include-deleted-resources=false --endpoint resourcecenter.aliyuncs.com --profile <runtime-profile> --user-agent AlibabaCloud-Agent-Skills/alibabacloud-resourcecenter-search",
      "user_agent": "AlibabaCloud-Agent-Skills/alibabacloud-resourcecenter-search",
      "exit_status": 0,
      "returned_resource_count": 0,
      "next_token_present": false,
      "resource_type_count": 0,
      "region_count": 0,
      "request_id_ref": "sha256:3e70d4d1e787babd7d98f6566bf4a75f99d832ab25f0f11286aae360897a9bf1",
      "argv_template_sha256": "8677a4d1979f1fd7f8769b58657e6a25d503f1ab3cf54a039d11b245bd35d1a5",
      "provider_http_attempts": "NOT_ASSESSED",
      "steps": [
        {
          "step_id": "VERIFY_PINNED_ALIYUN_CLI",
          "effect": "LOCAL_READ",
          "exit_status": 0
        },
        {
          "step_id": "VERIFY_PINNED_RESOURCECENTER_PLUGIN",
          "effect": "LOCAL_READ",
          "exit_status": 0
        },
        {
          "step_id": "ENABLE_AI_MODE",
          "effect": "LOCAL_CONFIG_WRITE",
          "exit_status": 0
        },
        {
          "step_id": "SET_FIXED_USER_AGENT",
          "effect": "LOCAL_CONFIG_WRITE",
          "exit_status": 0
        },
        {
          "step_id": "VERIFY_CLI_VERSION",
          "effect": "LOCAL_READ",
          "exit_status": 0
        },
        {
          "step_id": "VERIFY_PROFILE_CONFIGURATION",
          "effect": "LOCAL_READ",
          "exit_status": 0
        },
        {
          "step_id": "VERIFY_LIVE_CALLER_IDENTITY",
          "effect": "CLOUD_READ",
          "exit_status": 0
        },
        {
          "step_id": "REVERIFY_PINNED_RESOURCECENTER_PLUGIN_BEFORE_QUERY",
          "effect": "LOCAL_READ",
          "exit_status": 0
        },
        {
          "step_id": "RESOURCECENTER_SEARCH_RESOURCES",
          "effect": "CLOUD_READ",
          "exit_status": 0
        },
        {
          "step_id": "REVERIFY_PINNED_RESOURCECENTER_PLUGIN_AFTER_QUERY",
          "effect": "LOCAL_READ",
          "exit_status": 0
        },
        {
          "step_id": "DISABLE_AI_MODE",
          "effect": "LOCAL_CONFIG_WRITE",
          "exit_status": 0
        }
      ]
    },
    "checks": [
      {
        "check_id": "SKILL_SOURCE_HASH",
        "passed": true
      },
      {
        "check_id": "READ_ONLY_OPERATION_ALLOWLIST",
        "passed": true
      },
      {
        "check_id": "USER_PARAMETER_CONFIRMATION",
        "passed": true
      },
      {
        "check_id": "CREDENTIAL_REFERENCE_PRESENT",
        "passed": true
      },
      {
        "check_id": "READ_ONLY_POLICY_REFERENCE",
        "passed": true
      },
      {
        "check_id": "LIVE_READ_ONLY_IDENTITY_BINDING",
        "passed": true
      },
      {
        "check_id": "CLI_EXIT_STATUS_ZERO",
        "passed": true
      },
      {
        "check_id": "PAGINATION_COMPLETE",
        "passed": true
      },
      {
        "check_id": "NONEMPTY_VISIBLE_RESULT",
        "passed": false
      },
      {
        "check_id": "SANITIZED_OUTPUT_ONLY",
        "passed": true
      }
    ],
    "resourcecenter_write_api_calls": 0,
    "uncertainty": [
      "ZERO_RESULTS_ONLY_MEAN_NO_RESOURCES_VISIBLE_TO_THIS_BOUNDED_IDENTITY"
    ]
  },
  "permission_observation": {
    "$schema": "../schemas/alibabacloud-ram-policy-observation.v0.1.schema.json",
    "schema_version": "0.1.0",
    "observed_at": "2026-08-02T06:49:42.052182Z",
    "identity": {
      "type": "AssumedRoleUser",
      "identity_ref": "sha256:d5dfdaf092de944ea6a34dbc7edc16903b6aac180f69c0fb48d8b1a903c4dda1",
      "role_ref": "sha256:c172f1e2c0106e474ae5e0327854abf05c051f7e9a59fea9b1d97ae0b4b18a3f"
    },
    "attachment": {
      "role_ref": "sha256:c172f1e2c0106e474ae5e0327854abf05c051f7e9a59fea9b1d97ae0b4b18a3f",
      "policy_type": "System",
      "policy_name": "AliyunResourceCenterReadOnlyAccess",
      "total_attachment_count": 1,
      "system_policy_count": 1,
      "custom_policy_count": 0,
      "matching_attachment_count": 1,
      "unexpected_attachment_count": 0
    },
    "policy": {
      "version_id": "v2",
      "document_sha256": "e0e16cc23d7ec88b76f6e691ffd5edf7ad47c1bf518b25055ad9f10950c94663",
      "allow_actions": [
        "resourcecenter:ExecuteMultiAccountSQLQuery",
        "resourcecenter:ExecuteSQLQuery",
        "resourcecenter:Get*",
        "resourcecenter:List*",
        "resourcecenter:Search*",
        "tag:ListTag*"
      ],
      "deny_statement_count": 0,
      "write_operation_marker_count": 0
    },
    "read_trace": [
      {
        "operation": "ram.GetPolicy",
        "exit_status": 0,